{"schema_version":"1.0.0","run_id":"abk:run:artifact-dag-core-v1-control-com-03-normal-repeat-r2","request_id":"abk:run-request:artifact-dag-core-v1-control-com-03-normal-repeat-r2","campaign_id":"abk:benchmark-campaign:artifact-dag-core-v1","branch":"control","case_id":"COM-03-normal-repeat","repeat":2,"runner":{"contract_version":"control-runner-v1","executable_sha256":"a0e4929d124c831035546c8c65a1de7618da789d05a4bb24b645285421e859c1","host":"codex"},"input":{"fixture_sha256":"a337f79552f96b4dba030fa08f4e58cf760ee26a770d45b54d4946dbb7f5a152","campaign_sha256":"471b4f31608781205ce71d497add92d15659003a2a5852f1cc7fb59330b320d3","schema_sha256":"b4cacc60fe730faab91595f3f00b73ddf8729b494413a5eab5fa295e494b8aff","request_sha256":"f0913e23a415d79df73c31efb4ddd66ecf7106b835ae28ecd69ebcf3ab88d133"},"started_at":"2026-08-04T22:35:23Z","ended_at":"2026-08-04T22:35:24Z","duration_ms":305,"terminal_state":"SUCCEEDED","exit_code":0,"error":null,"readiness":{"relative_path":"readiness.json","sha256":"9aad03b93366f3eb44197943c19b4fe98f53e300966d715ff3f218aa4efe6f38"},"provenance":{"relative_path":"provenance.json","sha256":"2857334b4e74f6f9494a4224009f1dd390021ba3b03e9de5039f67d974fb4a67"},"state_before":{"manifest_sha256":"0000000000000000000000000000000000000000000000000000000000000000"},"state_after":{"manifest_sha256":"0000000000000000000000000000000000000000000000000000000000000000"},"recovery":null,"handoff":null}
