{"schema_version":"1.0.0","run_id":"abk:run:artifact-dag-core-v1-control-spc-04-composition-handoff-r1","request_id":"abk:run-request:artifact-dag-core-v1-control-spc-04-composition-handoff-r1","campaign_id":"abk:benchmark-campaign:artifact-dag-core-v1","branch":"control","case_id":"SPC-04-composition-handoff","repeat":1,"runner":{"contract_version":"control-runner-v1","executable_sha256":"a0e4929d124c831035546c8c65a1de7618da789d05a4bb24b645285421e859c1","host":"codex"},"input":{"fixture_sha256":"7ef01303a6b87f5a07fc187a09002b613f5ae405b3095babfde8b6ac2da6d4c3","campaign_sha256":"471b4f31608781205ce71d497add92d15659003a2a5852f1cc7fb59330b320d3","schema_sha256":"b4cacc60fe730faab91595f3f00b73ddf8729b494413a5eab5fa295e494b8aff","request_sha256":"5598bb26a2352e3baf4ca8bbe95c7f347277a94c09c4a49545f0410596b162a4"},"started_at":"2026-08-04T22:35:51Z","ended_at":"2026-08-04T22:35:52Z","duration_ms":247,"terminal_state":"SUCCEEDED","exit_code":0,"error":null,"readiness":{"relative_path":"readiness.json","sha256":"e8b0986b4bd521175a1527db25a37d648ab91fb980083948d57f6b14f543ea17"},"provenance":{"relative_path":"provenance.json","sha256":"52964d46055d6054fb579eef5f14cb2931acb6edbf74cd4c348e15cb066c12ef"},"state_before":{"manifest_sha256":"0000000000000000000000000000000000000000000000000000000000000000"},"state_after":{"manifest_sha256":"0000000000000000000000000000000000000000000000000000000000000000"},"recovery":null,"handoff":null}
