{"schema_version":"1.0.0","run_id":"abk:run:artifact-dag-core-v1-control-com-02-normal-variant-r1","request_id":"abk:run-request:artifact-dag-core-v1-control-com-02-normal-variant-r1","campaign_id":"abk:benchmark-campaign:artifact-dag-core-v1","branch":"control","case_id":"COM-02-normal-variant","repeat":1,"runner":{"contract_version":"control-runner-v1","executable_sha256":"a0e4929d124c831035546c8c65a1de7618da789d05a4bb24b645285421e859c1","host":"codex"},"input":{"fixture_sha256":"846ed6317d8bf0af1ed2aa2017e647e9d2502db399f451322eebae9fc9806943","campaign_sha256":"471b4f31608781205ce71d497add92d15659003a2a5852f1cc7fb59330b320d3","schema_sha256":"b4cacc60fe730faab91595f3f00b73ddf8729b494413a5eab5fa295e494b8aff","request_sha256":"400ac7f14c9e7893df5d4937b76f26f65863852511ae87a37d50acbe158ddffb"},"started_at":"2026-08-04T22:35:16Z","ended_at":"2026-08-04T22:35:16Z","duration_ms":233,"terminal_state":"SUCCEEDED","exit_code":0,"error":null,"readiness":{"relative_path":"readiness.json","sha256":"49a6b89535596ed68298f87b035dc4387b00af57912509462df137d08ce731ac"},"provenance":{"relative_path":"provenance.json","sha256":"bbddd9bc1400970eb6a3649ea7b064985ae72fd64cdc6d821973140fc39cb2f9"},"state_before":{"manifest_sha256":"0000000000000000000000000000000000000000000000000000000000000000"},"state_after":{"manifest_sha256":"0000000000000000000000000000000000000000000000000000000000000000"},"recovery":null,"handoff":null}
