{"schema_version":"1.0.0","run_id":"abk:run:artifact-dag-core-v1-control-com-01-normal-primary-r1","request_id":"abk:run-request:artifact-dag-core-v1-control-com-01-normal-primary-r1","campaign_id":"abk:benchmark-campaign:artifact-dag-core-v1","branch":"control","case_id":"COM-01-normal-primary","repeat":1,"runner":{"contract_version":"control-runner-v1","executable_sha256":"a0e4929d124c831035546c8c65a1de7618da789d05a4bb24b645285421e859c1","host":"codex"},"input":{"fixture_sha256":"62f997d1e3a0aded32dde6468b3ec342d7c3a52d87839deeb7c6cf7a040d1bfe","campaign_sha256":"471b4f31608781205ce71d497add92d15659003a2a5852f1cc7fb59330b320d3","schema_sha256":"b4cacc60fe730faab91595f3f00b73ddf8729b494413a5eab5fa295e494b8aff","request_sha256":"56a2b4f2e52bdccef1f93ee9e20915ecfc083e56da0608460311fcceadedf390"},"started_at":"2026-08-04T22:35:10Z","ended_at":"2026-08-04T22:35:10Z","duration_ms":320,"terminal_state":"SUCCEEDED","exit_code":0,"error":null,"readiness":{"relative_path":"readiness.json","sha256":"d5bc4d18b4cbca1bb1760ad48784e0c104eb66de27d8df283ee1b2bff533e2cc"},"provenance":{"relative_path":"provenance.json","sha256":"a81772c619a2206ef8bbc3e1149beaef89306116acb097cb7e8a9e4428ebd9cf"},"state_before":{"manifest_sha256":"0000000000000000000000000000000000000000000000000000000000000000"},"state_after":{"manifest_sha256":"0000000000000000000000000000000000000000000000000000000000000000"},"recovery":null,"handoff":null}
