{"schema_version":"1.0.0","run_id":"abk:run:artifact-dag-core-v1-control-spc-01-domain-boundary-r1","request_id":"abk:run-request:artifact-dag-core-v1-control-spc-01-domain-boundary-r1","campaign_id":"abk:benchmark-campaign:artifact-dag-core-v1","branch":"control","case_id":"SPC-01-domain-boundary","repeat":1,"runner":{"contract_version":"control-runner-v1","executable_sha256":"a0e4929d124c831035546c8c65a1de7618da789d05a4bb24b645285421e859c1","host":"codex"},"input":{"fixture_sha256":"7232aaa098862821374ad852d0c07d6a82f83928ec8bdfd0738e1132a726cfb9","campaign_sha256":"471b4f31608781205ce71d497add92d15659003a2a5852f1cc7fb59330b320d3","schema_sha256":"b4cacc60fe730faab91595f3f00b73ddf8729b494413a5eab5fa295e494b8aff","request_sha256":"b201b2942dcc1f57513177ac71ab5b3ee18fa4a267f1b6795b0c1e92df0063f7"},"started_at":"2026-08-04T22:35:41Z","ended_at":"2026-08-04T22:35:41Z","duration_ms":235,"terminal_state":"FAILED","exit_code":3,"error":{"code":"UNKNOWN_ARTIFACT_REFERENCE","retryable":false,"message":"Artifact 'spec' depends on unknown artifact '../outside'.","field":"project.artifacts.depends_on"},"readiness":null,"provenance":null,"state_before":{"manifest_sha256":"0000000000000000000000000000000000000000000000000000000000000000"},"state_after":{"manifest_sha256":"0000000000000000000000000000000000000000000000000000000000000000"},"recovery":null,"handoff":null}
