{"schema_version":"1.0.0","run_id":"abk:run:artifact-dag-core-v1-control-com-06-stop-interrupt-r2","request_id":"abk:run-request:artifact-dag-core-v1-control-com-06-stop-interrupt-r2","campaign_id":"abk:benchmark-campaign:artifact-dag-core-v1","branch":"control","case_id":"COM-06-stop-interrupt","repeat":2,"runner":{"contract_version":"control-runner-v1","executable_sha256":"a0e4929d124c831035546c8c65a1de7618da789d05a4bb24b645285421e859c1","host":"codex"},"input":{"fixture_sha256":"177325140d819ca9ce3416409a70122911a4f44148a8a788e3a0de5505b53c40","campaign_sha256":"471b4f31608781205ce71d497add92d15659003a2a5852f1cc7fb59330b320d3","schema_sha256":"b4cacc60fe730faab91595f3f00b73ddf8729b494413a5eab5fa295e494b8aff","request_sha256":"73ecce73ae7a8b51edc1cc928ca4873dcd91dccde631cf629d1dddfb8ccb9f0f"},"started_at":"2026-08-04T22:35:35Z","ended_at":"2026-08-04T22:35:35Z","duration_ms":257,"terminal_state":"SUCCEEDED","exit_code":0,"error":null,"readiness":{"relative_path":"readiness.json","sha256":"0cc9dbb8745169dfde636d57baae4adaa4259c60d52c07a20282c6f9664d0998"},"provenance":{"relative_path":"provenance.json","sha256":"e96dcf19dbda7343ca67ce9ce0f27e4a2ed274e62a66992beef1817604f4e036"},"state_before":{"manifest_sha256":"0000000000000000000000000000000000000000000000000000000000000000"},"state_after":{"manifest_sha256":"0000000000000000000000000000000000000000000000000000000000000000"},"recovery":null,"handoff":null}
