{"schema_version":"1.0.0","run_id":"abk:run:artifact-dag-core-v1-control-spc-03-recovery-rollback-r2","request_id":"abk:run-request:artifact-dag-core-v1-control-spc-03-recovery-rollback-r2","campaign_id":"abk:benchmark-campaign:artifact-dag-core-v1","branch":"control","case_id":"SPC-03-recovery-rollback","repeat":2,"runner":{"contract_version":"control-runner-v1","executable_sha256":"a0e4929d124c831035546c8c65a1de7618da789d05a4bb24b645285421e859c1","host":"codex"},"input":{"fixture_sha256":"ce339295134d2036f96615accc8d1e1e9f7a5fd4c73821b9fab2c868cb0fefaa","campaign_sha256":"471b4f31608781205ce71d497add92d15659003a2a5852f1cc7fb59330b320d3","schema_sha256":"b4cacc60fe730faab91595f3f00b73ddf8729b494413a5eab5fa295e494b8aff","request_sha256":"b053a878e4515078b1f16cc5c70ab3b6e71aaf1d1cdfa769379fcac813a2569f"},"started_at":"2026-08-04T22:35:45Z","ended_at":"2026-08-04T22:35:46Z","duration_ms":219,"terminal_state":"SUCCEEDED","exit_code":0,"error":null,"readiness":{"relative_path":"readiness.json","sha256":"627a0e7d773141b573d0181fdac200d41c87f565e20c544714225a43843bbc4b"},"provenance":{"relative_path":"provenance.json","sha256":"69781c82fc19ce8afa6a37d4f8aefb5dde20e20c76c70363dca834c67d911edf"},"state_before":{"manifest_sha256":"0000000000000000000000000000000000000000000000000000000000000000"},"state_after":{"manifest_sha256":"0000000000000000000000000000000000000000000000000000000000000000"},"recovery":null,"handoff":null}
